{
  "schema_version": "1.5.0",
  "standard_version": "0.8.0",
  "auditor_version": "0.8.0",
  "receipt_id": "hl3-pass-minimal-fast",
  "lane": "fast",
  "command": "cargo check -p fixture",
  "exit_code": 0,
  "elapsed_ms": 1,
  "artifacts": ["proof-receipts/fast.json"],
  "changed_paths": ["README.md"],
  "generated_at": "2026-05-05T00:00:00Z"
}
